{
  "id": "runner-0001",
  "name": "Neon Dash",
  "created_at": "2026-05-31T00:17:56.976Z",
  "updated_at": "2026-05-31T00:27:01.677Z",
  "status": "playable",
  "concept": {
    "genre": "endless runner",
    "core_loop": "tap to jump over oncoming neon obstacles; survive as long as possible while the world scrolls faster; score climbs with distance",
    "mechanics": [
      "jump",
      "gravity",
      "ground collision",
      "obstacle spawning",
      "obstacle collision",
      "score",
      "game over",
      "tap to restart"
    ],
    "art_direction": "neon vector on near-black (#0a0a12); bright cyan (#22e6ff) player square, magenta (#ff3df0) and yellow (#ffe14d) obstacle bars, thin glowing ground line; flat minimal shapes with subtle additive glow",
    "target_platforms": [
      "android"
    ],
    "differentiation_notes": "one-button single-tap control; speed ramps with score so tension rises without added input complexity"
  },
  "build": {
    "engine": "godot",
    "engine_version": "4.6.3.stable",
    "language": "gdscript",
    "project_path": "games/runner-0001/",
    "addons": [],
    "export_presets": [
      "android"
    ]
  },
  "assets": [
    {
      "type": "sprite",
      "name": "player",
      "source": "placeholder",
      "origin": "primitive"
    },
    {
      "type": "sprite",
      "name": "obstacle",
      "source": "placeholder",
      "origin": "primitive"
    },
    {
      "type": "sprite",
      "name": "ground",
      "source": "placeholder",
      "origin": "primitive"
    }
  ],
  "validation": {
    "issues": [],
    "opens_in_editor": true,
    "runs": true,
    "core_loop_functional": true
  },
  "_reserved": {
    "compliance": null,
    "store": null,
    "maintenance": null
  }
}
